HS.Code_4,Description
3913,"Natural Polymers (e.g. Alginic Acid) and Modified Natural Polymers (e.g. Hardened Proteins, Chemical Derivatives of Natural Rubber), n.e.s. or included, in primary forms"
3914,"Ion-exchangers; Based on Polymers of Heading No. 3901 to 3913, in primary forms"
3915,"Waste, Parings and Scrap, of Plastics"
3916,"Monofilament of which any Cross-sectional Dimension exceeds 1mm, Rods, Sticks and Profile shapes, whether or not Surface- Worked but not otherwise Worked, of Plastics"
3917,"Tubes, Pipes and Hoses and Fittings thereof (for Example, Joints, Elbows, Flanges), of Plastics"
3918,"Floor Coverings of Plastics, Self-adhesive or not, in Rolls or Tiles; Wall or Ceiling Coverings of Plastics, in Rolls of a Width not Less than 45cm"
3919,"Self-adhesive Plates, Sheets, Film, Foil, Tape, Strip and other Flat shapes, of Plastics, whether or not in Rolls"
3920,"Plastic Plates, Sheets, Film, Foil and Strip; Non-cellular and not Reinforced, Laminated, Supported or similarly Combined with other Materials, n.e.s. in Chapter 39"
3921,"Plastic Plates, Sheets, Film, Foil and Strip n.e.s. in Chapter 39"
3922,"Sanitary Ware; Baths, Shower-baths, Wash- Basins, Bidets, Lavatory Pans, Seats and Covers, Flushing Cisterns and similar articles, of Plastic"
3923,Plastic articles for the Conveyance or Packing of Goods;
3924,"Tableware, Kitchenware, other Household articles and Toilet articles, of Plastics"
3925,Plastics; Builders' Wares n.e.s. or included
3926,"Articles of Plastics and articles of other Materials of Heading No. 3901 to 3914, n.e.s. in Chapter 39"
4001,"Natural Rubber, Balata, Gutta-percha, Guayule, Chicle and similar Gums; in primary forms or in Plates, Sheets or Strip"
4002,"Synthetic Rubber and Factice Derived from Oils, in primary forms or in Plates, Sheets or Strip; Mixtures of Heading No. 4001 and 4002, in primary forms or in Plates, Sheets or Strip"
4003,"Reclaimed Rubber in primary forms or in Plates, Sheets or Strip"
4004,"Waste, Parings and Scrap of Rubber (other than Hard Rubber) and Powders and Granules Obtained Therefrom"
4005,"Compounded Rubber, Unvulcanised, in primary forms or in Plates, Sheets or Strip"
4006,"Unvulcanised Rubber in other forms (e.g. Rods, Tubes and Profile shapes and articles (e.g. Discs and Rings)"
4007,Vulcanised Rubber Thread and Cord
4008,"Plates, Sheets, Strip, Rods and Profile shapes, of Vulcanised Rubber other than Hard Rubber"
4009,"Tubes, Pipes and Hoses, of Vulcanised Rubber (other than Hard Rubber), with or without their Fittings (e.g. Joints, Elbows, Flanges)"
4010,"Conveyor or Transmission Belts or Belting, of Vulcanised Rubber"
4011,"New Pneumatic Tyres, of Rubber"
4012,"Retreaded or used Pneumatic Tyres of Rubber; Solid or Cushion Tyres, Interchangeable Tyre Treads and Tyre Flaps, of Rubber"
4013,"Inner Tubes, of Rubber"
4014,"Hygienic or Pharmaceutical articles (including Teats), of Vulcanised Rubber other than Hard Rubber, with or without Fittings of Hard Rubber"
4015,"Articles of Apparel and Clothing Accessories (including Gloves), for All purposes, of Vulcanised Rubber other than Hard Rubber"
4016,"Articles of Vulcanised Rubber other than Hard Rubber, n.e.s. in Chapter 40"
4017,"Hard Rubber (e.g. Ebonite) in All forms, including waste and Scrap; articles of Hard Rubber"
4101,"Raw Hides and Skins of Bovine or Equine Animals (fresh, Salted, Dried, Limed, Pickled, otherwise preserved but not Tanned, Parchment Dressed or Further Prepared), whether or not Dehaired or Split"
4102,"Raw Skins of Sheep or Lambs (fresh, Salted, Dried, Limed, Pickled or otherwise preserved, but not Further Prepared), whether or not with Wool on or Split"
4103,"Raw Hides and Skins N.e.s in Headings No. 4101, 4102; Fresh, Salted, Dried, Pickled or otherwise preserved, not Further prepared, whether or not Dehaired or Split"
4104,"Leather of Bovine or Equine Animals, without Hair on, excluding Leather of Heading No. 4108 or 4109"
4105,"Sheep or Lamb Skin Leather, without Wool on, excluding Leather of Heading No. 4108 or 4109"
4106,"Leather; Goat or Kid Skin, without Hair on, other than Leather of Heading No. 4108 or 4109"
4107,"Leather; of Animals n.e.s. in Chapter 41, without Hair on, excluding Leather of Heading No. 4108 or 4109"
4108,Chamois (including Combination Chamois) Leather
4109,"Patent Leather and Patent Laminated Leather, Metallised Leather"
4110,"Parings and other waste of Leather or of Composition Leather, not Suitable for the Manufacture of Leather articles; Leather Dust, powder and Flour"
4111,"Composition Leather with a basis of Leather or Leather Fibre, in Slabs, Sheets or Strip whether or not in Rolls"
4201,"Saddlery and Harness for any Animal (including Traces, Leads, Knee Pads, Muzzles, Saddle Cloths, Saddle Bags, Dog Coats and the Like) of any Material"
4202,"Trunks; Suit, Camera, Jewellery, Cutlery Cases; Travel, Tool, similar Bags; Wholly or mainly Covered by Leather, Composition Leather, Plastic Sheeting, Textile Materials, Vulcanised Fibre, Paperboard"
4203,"Articles of Apparel and Clothing Accessories, of Leather or of Composition Leather"
4204,"Articles of Leather or of Composition Leather, of a kind used in Machinery or Mechanical Appliances or for other Technical uses"
4205,Leather or Composition Leather articles n.e.s. in Chapter 42
4206,"Articles of Gut (other than Silk-worm Gut), of Goldbeater's Skin, of Bladders or of Tendons"
4301,"Raw Furskins (including Heads, Tails, Paws, other Pieces or Cuttings, Suitable for Furriers' Use), excluding Raw Hides and Skins of Heading No. 4101, 4102 or 4103"
4302,"Tanned or Dressed Furskins (including Heads, Tails, Paws, other Pieces, Cuttings), Unassembled, Assembled (without Addition of other Materials), excluding those of Heading No. 4303"
4303,"Articles of Apparel, Clothing Accessories and other articles of Furskin"
4304,Artificial Fur and articles thereof
4401,"Fuel Wood, in Logs, Billets, Twigs, Faggots or similar forms; Wood in Chip or Particles; Sawdust and Wood waste and Scrap, whether or not Agglomerated in Logs, Briquettes, Pellets or similar forms"
4402,"Wood Charcoal (including Shell or Nut Charcoal), whether or not Agglomerated"
4403,"Wood in the Rough, whether or not Stripped of Bark or Sapwood, or Roughly Squared"
4404,"Hoopwood; Split Poles; Piles, Pickets, Stakes of Wood, Pointed, not Sawn Length- Wise; Wooden Sticks, Roughly Trimmed, not Turned, Bent, Etc., Suitable for Walking Sticks, Umbrellas, Tool Handles, Etc."
4405,Wood Wool; Wood Flour
4406,Railway or Tramway Sleepers (cross Ties) of Wood
4407,"Wood Sawn or Chipped Lengthwise, sliced, Peeled, whether or not Planed, Sanded or Finger Jointed, of a Thickness exceeding 6mm"
4408,"Veneer Sheets and Sheets for Plywood (spliced or Not) and other Wood Sawn Lengthwise, sliced or Peeled, whether or not Planed, Sanded or Finger-jointed, of a Thickness not exceeding 6mm"
4409,"Wood (including Strips, Friezes for Parquet Flooring, not Assembled), Continuously Shaped (tongued, Grooved, V-jointed, Beaded or the Like) Along any Edge or Face, Planed Sanded, Finger-jointed or not"
4410,"Particle Board and similar Board; of Wood or other Ligneous Materials, whether or not Agglomerated with Resins or other Organic Binding Substances"
4411,"Fibreboard of Wood or other Ligneous Materials, whether or not Bonded with Resins or other Organic Substances"
4412,"Plywood, Veneered Panels and similar Laminated Wood"
4413,"Densified Wood, in Blocks, Plates, Strips or Profile shapes"
4414,"Wooden Frames; for Paintings, Photographs, Mirrors or similar Objects"
4415,"Packing Cases, Boxes, Crates, Drums and similar Packings, of Wood; Cable Drums of Wood; Pallets, Box Pallets and other Load Boards, of Wood"
4416,"Casks, Barrels, Vats, Tubs and other Coopers' Products and Parts thereof, of Wood, including Staves"
4417,"Tools, Tool Bodies, Tool Handles, Broom or Brush Bodies and Handles, of Wood; Boot or Shoe Lasts and Trees, of Wood"
4418,"Builders' Joinery and Carpentry of Wood, including Cellular Wood Panels, Assembled Parquet Panels, Shingles and Shakes"
4419,"Tableware and Kitchenware, of Wood"
4420,"Wood Marquetry and Inlaid Wood; Caskets and Cases for Jewellery or Cutlery, and similar articles of Wood; Statuettes and other Ornaments of Wood; Wooden articles of Furniture not Falling in Chapter 94"
4421,Wooden articles n.e.s. in Heading No. 4414 to 4420
4501,"Cork; Natural, Raw or simply prepared; waste Cork; Crushed, Granulated or Ground Cork"
4502,"Cork; Natural, Debacked or Roughly Squared, or in Rectangular (including Square) Blocks, Plates, Sheets or Strip, (including Sharp-edged Blanks for Corks or Stoppers)"
4503,Cork; articles of Natural Cork
4504,Cork; Agglomerated (with or without a Binding Substance) and articles of Agglomerated Cork
4601,"Plaits and similar Products of Plaiting Materials, Assembled into Strips or not; Plaiting Materials, Plaits and the like Bound Together in Parallel Strands or Woven in Sheet form, Finished articles or not"
4602,"Basketwork, Wickerwork and other articles, made Directly to shape from Plaiting Materials or made up from Goods of Heading No. 4601; articles of Loofah"
4701,"Wood Pulp, Mechanical Wood Pulp"
4702,"Chemical Wood Pulp, Dissolving Grades"
4703,"Chemical Wood Pulp, Soda or Sulphate, other than Dissolving Grades"
4704,"Chemical Wood Pulp, Sulphite, other than Dissolving Grades"
4705,Wood Pulp; Semi-chemical
4706,Pulps of other Fibrous Cellulosic Material
4707,Paper and Paperboard; waste and Scrap
4801,"Newsprint, in Rolls or Sheets"
4802,"Paper and Paperboard, Uncoated, used for Writing, Printing Etc., Punch Card Stock and Punch Tape Paper, in Rolls or Sheets, excluding Paper of Heading No. 4801 or 4803; Hand-made Paper or Paperboard"
4803,"Towel or Napkin Stock, similar Paper for Household, Sanitary uses, Cellulose Wadding, Webs of Cellulose Fibres, in Rolls over 36cm in Width or Rectangular Sheets, one Side exceeding 36cm when Unfolded"
4804,"Kraft Paper and Paperboard, Uncoated, in Rolls or Sheets, other than that of Heading No. 4802 or 4803"
4805,"Paper and Paperboard n.e.s., Uncoated, in Rolls or Sheets"
4806,"Vegetable Parchment, Greaseproof Papers, Tracing Papers, Glassine and other Glazed Transparent or Translucent Papers, in Rolls or Sheets"
4807,"Composite Paper and Paperboard, (made by Sticking Layers Together with an Adhesive), not Surface-coated or Impregnated, whether or not Internally Reinforced, in Rolls or Sheets"
4808,"Paper and Paperboard, Corrugated (with or without Glued Flat Surface Sheets), Creped, Crinkled, Embossed or Perforated, in Rolls or Sheets other than those of Heading No. 4803 or 4818"
4809,"Carbon Paper, Self Copy Paper and the like (coated, Impregnated for Duplicator Stencils, Offset Plates), Printed or not; Rolls over 36cm Wide, Rectangular Sheets with one Unfolded Side exceeding 36cm"
4810,"Paper and Paperboard, one or Both Sides Coated with Kaolin or other Inorganic Sub- Stances, with Binder or not, No other Coat- Ing; Surface-coloured, Surface-decorated, Printed or not, in Rolls or Sheets"
4811,"Paper, Paperboard, Cellulose Wadding and Webs of Cellulose Fibres, Coated, Impreg- Nated, Covered, Surface-coloured, Decorated or Printed, Rolls or Sheets, Excl. Goods of Heading No. 4803, 4809, 4810 and 4818"
4812,"Filter Blocks, Slabs and Plates of Paper Pulp"
4813,"Cigarette Paper, whether or not cut to Size or in the form of Booklets or Tubes"
4814,Wallpaper and similar Wall Coverings; Window Transparencies of Pap
4815,"Floor Coverings on a Base of Paper or of Paperboard, whether or not cut to Size"
4816,"Carbon Paper, Self-copy Paper and other Copying or Transfer Papers, (other than those of Heading No. 4809), Duplicator Stencils and Offset Plates, of Paper whether or not put up in Boxes"
4817,"Envelopes, Letter Cards, Plain Postcards and Correspondence Cards, of Paper, Paperboard; Boxes, Pouches, Wallets and Writing Compendiums, of Paper or Paperboard containing Assortment of Paper Stationery"
4818,"Paper Towels, Toilet Paper, Tissues, Handkerchiefs, Napkins, Tampons, Serviettes and similar Household, Sanitary and Hospital articles of Paper"
4819,"Cartons, Boxes, Cases, Bags and the like, of Paper, Paperboard, Cellulose Wadding or Fibres; Box Files, Letter Trays and the like, of Paper or Paperboard, of a kind used in Offices, Shops or the like"
4820,"Registers, Account Books, Diaries and similar; Albums for Samples or Collections, of Paper or Paperboard"
4821,"Paper or Paperboard Labels of All kinds, whether or not Printed"
4822,"Bobbins, Spools, Cops and similar Supports of Paper Pulp, Paper or Paperboard (whether or not Perforated or Hardened)"
4823,"Paper, Paperboard, Cellulose Wadding and Webs of Cellulose Fibres; cut to Size or shape, articles of Paper Pulp, Paper, Paperboard, Cellulose Wadding or Webs of Cellulose Fibres, n.e.s. in Chapter 48"
4901,"Printed Books, Brochures, Leaflets and similar Printed Matter, whether or not in Single Sheets"
4902,"Newspapers, Journals and Periodicals, whether or not Illustrated or containing Advertising Material"
4903,"Children's Picture, Drawing or Colouring Books"
4904,"Music, Printed or in Manuscript, whether or not Bound or Illustrated"
4905,"Maps and Hydrographic or similar Charts of All kinds, including Atlases, Wall Maps, Topographical Plans and Globes, Printed"
4906,"Plans and Drawings; for Architectural, Engineering, Industrial, Commercial, Topographical or similar, being Originals Drawn by Hand; Hand-written Texts; Photo- Graphic Reproductions; their Carbon Copies"
4907,"Unused Postage, Revenue or similar Stamps of Current or New Issue in the Country to which Destined; Stamp-impressed Paper; Cheque forms; Banknotes, Stock, Share or Bond Certificates and the like"
4908,Transfers (decalcomanias)
4909,"Printed or Illustrated Postcards; Printed Cards Bearing Personal Greetings, Messages or Announcements, whether or not Illustrated, with or without Envelopes or Trimmings"
4910,"Calendars of any kind, Printed, including Calendar Blocks"
4911,"Printed Matter, n.e.s., including Printed Pictures and Photographs"
5001,Silk-worm Cocoons Suitable for Reeling
5002,Silk; Raw (not Thrown)
5003,"Silk waste (including Cocoons Unsuitable for Reeling, Yarn waste and Garnetted Stock)"
5004,"Silk; Yarn (other than Yarn Spun from Silk Waste), not put up for Retail Sale"
5005,"Yarn Spun from Silk waste, not put up for Retail Sale"
5006,"Silk Yarn and Yarn Spun from Silk waste, put up for Retail Sale; Silk-worm Gut"
5007,Woven Fabrics of Silk or of Silk waste
5101,"Wool, not Carded or Combed"
5102,"Fine or Coarse Animal Hair, not Carded or Combed"
5103,"Waste of Wool or of Fine or Coarse Animal Hair, including Yarn waste but excluding Garnetted Stock"
5104,"Wool, or Fine or Coarse Animal Hair; Garnetted Stock"
5105,Wool and Fine or Coarse Animal Hair; Carded or Combed (including Combed Wool in Fragments)
5106,"Yarn of Carded Wool, not put up for Retail Sale"
5107,"Yarn of Combed Wool, not put up for Retail Sale"
5108,"Yarn of Fine Animal Hair (carded or Combed), not put up for Retail Sale"
5109,"Yarn of Wool or of Fine Animal Hair, put up for Retail Sale"
5110,"Yarn of Coarse Animal Hair or of Horsehair (including Gimped Horsehair Yarn), whether or not put up for Retail Sale"
5111,Woven Fabrics of Carded Wool or of Carded Fine Animal Hair
5112,Woven Fabrics of Combed Wool or of Combed Fine Animal Hair
5113,Woven Fabrics of Coarse Animal Hair or of Horsehair
5201,Cotton; not Carded or Combed
5202,Cotton waste (including Yarn waste and Garnetted Stock)
5203,"Cotton, Carded or Combed"
5204,"Cotton Sewing Thread, whether or not put up for Retail Sale"
5205,"Cotton Yarn (other than Sewing Thread), containing 85% or more by Weight of Cotton, not put up for Retail Sale"
5206,"Cotton Yarn (other than Sewing Thread), containing Less than 85% by Weight of Cotton, not put up for Retail Sale"
5207,"Cotton Yarn (other than Sewing Thread), put up for Retail Sale"
5208,"Woven Fabrics of Cotton, containing 85% or more by Weight of Cotton, weighing not more than 200 G/m2"
5209,"Woven Fabrics of Cotton; containing 85% or more by Weight of Cotton, weighing more than 200 G/m2"
5210,"Woven Fabrics of Cotton, containing Less than 85% by Weight of Cotton, Mixed mainly or solely with Man-made Fibres, weighing not more than 200 G/m2"
5211,"Woven Fabrics of Cotton, containing Less than 85% by Weight of Cotton, Mixed mainly or solely with Man-made Fibres, weighing more than 200g/m2"
5212,Cotton; other Woven Fabrics
5301,"Flax, Raw or processed but not Spun; Flax Tow and waste (including Yarn waste and Garnetted Stock)"
5302,"True Hemp (cannabis Sativa L.), Raw or processed but not Spun; Tow and waste of True Hemp (including Yarn waste and Garnetted Stock)"
5303,"Jute and other Textile Bast Fibres (not Flax, True Hemp and Ramie), Raw or processed but not Spun; Tow and waste of these Fibres, including Yarn waste and Garnetted Stock"
5304,"Sisal and other Textile Fibres of Genus Agave, Raw or processed but not Spun; Tow and waste of these Fibres (including Yarn waste and Garnetted Stock)"
5305,"Coconut, Abaca (manilla Hemp or Musa Textilis Nee), Ramie and other Vegetable Textile Fibres n.e.s., Raw or processed but not Spun; Tow and waste of these Fibres (including Yarn waste and Garnetted Stock)"
5306,Flax Yarn
5307,Yarn of Jute or of other Textile Bast Fibres of Heading No. 5305
5308,Yarn of other Vegetable Textile Fibres; Paper Yarn
5309,Woven Fabrics of Flax
5310,"Woven Fabrics of Jute, other Textile Bast Fibres of Heading No. 5303"
5311,Woven Fabrics of other Vegetable Textile Fibres; Woven Fabrics of Paper Yarn
5401,"Sewing Thread of Man-made Filaments, whether or not put up for Retail Sale"
5402,"Synthetic Filament Yarn (other than Sewing Thread), not put up for Retail Sale, including Synthetic Monofilament of Less than 67 Decitex"
5403,"Artificial Filament Yarn (other than Sewing Thread), not put up for Retail Sale, including Artificial Monofilament of Less than 67 Decitex"
5404,"Synthetic Monofilament of 67 Decitex or more, of which No Crosssectional Dimension exceeds 1mm; Strip and the like (e.g. Artificial Straw), of Synthetic Textile Materials of a Width not exceeding 5mm"
5405,"Artificial Monofilament of 67 Decitex or more, No Cross-sectional Dimension exceeds 1mm; Strip and the like (e.g. Artificial Straw), of Artificial Textile Materials of a Width not exceeding 5mm"
5406,"Man-made Filament Yarn (other than Sewing Thread), put up for Retail Sale"
5407,"Woven Fabrics of Synthetic Filament Yarn, including Woven Fabrics Obtained from Materials of Heading No. 5404"
5408,Woven Fabrics of Artificial Filament Yarn including Woven Fabrics Obtained from Materials of Heading No. 5405
5501,Synthetic Filament Tow
5502,Artificial Filament Tow
5503,"Synthetic Staple Fibres, not Carded, Combed or otherwise processed for Spinning"
5504,"Artificial Staple Fibres, not Carded, Combed or otherwise processed for Spinning"
5505,"Waste (including Noils, Yarn waste and Garnetted Stock), of Man-made Fibres"
5506,"Synthetic Staple Fibres, Carded, Combed or otherwise processed for Spinning"
5507,"Artificial Staple Fibres, Carded, Combed or otherwise processed for Spinning"
5508,"Sewing Thread of Man-made Staple Fibres, whether or not put up for Retail Sale"
5509,"Yarn (other than Sewing Thread) of Synthetic Staple Fibres, not put up for Retail Sale"
5510,"Yarn (other than Sewing Thread) of Artificial Staple Fibres, not put up for Retail Sale"
5511,"Yarn (other than Sewing Thread) of Man-made Staple Fibres, put up for Retail Sale"
5512,"Woven Fabrics of Synthetic Staple Fibres, containing 85% or more by Weight of Synthetic Staple Fibres"
5513,"Woven Fabrics of Synthetic Staple Fibres containing Less than 85% of such Fibres, Mixed mainly or solely with Cotton, of a Weight not exceeding 170g/m2"
5514,"Woven Fabrics of Synthetic Staple Fibres containing Less than 85% by Weight of such Fibres, Mixed mainly or solely with Cotton, of a Weight exceeding 170g/m2"
5515,Woven Fabrics; of Synthetic Staple Fibres n.e.s. in Chapter 55
5516,Woven Fabrics of Artificial Staple Fibres
5601,"Wadding of Textile Materials and articles thereof; Textile Fibres, not exceeding 5 mm in Length (flock), Textile Dust and Mill Neps"
5602,"Felt; whether or not Impregnated, Coated, Covered or Laminated"
5603,"Nonwovens; whether or not Impregnated, Coated, Covered or Laminated"
5604,"Rubber Thread and Cord, Textile Covered; Textile Yarn and Strip and the like of Heading No. 5404, 5405; Impregnated, Coated, Covered or Sheathed with Rubber or Plastics"
5605,"Yarn; Metallised, whether or not Gimped, of Textile Yarn, or Strip or the like of Heading No. 5404 or 5405, Combined with Metal in the form of Thread, Strip or powder or Covered with Metal"
5606,"Yarn and Strip and the like of Heading No. 5404 or 5405, Gimped (other than those of Heading No. 5605 and Gimped Horsehair Yarn); Chenille Yarn (including Flock Chenille Yarn); Loop Wale-yarn"
5607,"Twine, Cordage, Ropes and Cables, whether or not Plaited or Braided; whether or not Impregnated, Coated, Covered or Sheathed with Rubber or Plastics"
5608,"Twine, Cordage or Rope; Knotted Netting, made up Fishing Nets and other made up Nets, of Textile Materials"
5609,"Articles of Yarn, Strip or the like of Heading No. 5404 or 5405; Twine, Cordage, Rope or Cables n.e.s. or included"
5701,"Carpets and other Textile Floor Coverings; Knotted, whether or not made up"
5702,"Carpets and other Textile Floor Coverings; Woven, not Tufted or Flocked, whether or not made up, including ""kelem"", ""schumacks"", ""karamanie"" and similar Hand- Woven Rugs"
5703,"Carpets and other Textile Floor Coverings; Tufted, whether or not made up"
5704,"Carpets and other Textile Floor Coverings; of Felt, not Tufted or Flocked, whether or not made up"
5705,"Carpets and other Textile Floor Coverings; n.e.s. in Chapter 57, whether or not made up"
5801,"Fabrics; Woven Pile and Chenille Fabrics, other than Fabrics of Heading No. 5802 or 5806"
5802,"Fabrics; Terry Towelling and similar Woven Terry Fabrics other than Narrow Fabrics of Heading No. 5806; Tufted Textile Fabrics, excluding Products of Heading No. 5703"
5803,Gauze; other than Narrow Fabrics of Heading No. 5806
5804,"Tulles and other Net Fabrics; not including Woven, Knitted or Crocheted Fabrics; Lace in the Piece, in Strips or in Motifs"
5805,"Tapestries; Hand-woven, (gobelins, Flanders, Aubusson, Beauvais and the Like) and Needle-worked Tapestries (e.g. Petit Point, Crossstitch) whether or not made up"
5806,"Fabrics; Narrow Woven, other than Goods of Heading No. 5807; Narrow Fabrics Consisting of Warp without Weft Assembled by Means of an Adhesive (bolducs)"
5807,"Labels, Badges and similar articles; of Textile Materials, in the Piece, in Strips or cut to shape or Size, not Embroidered"
5808,"Braids in the Piece; Ornamental Trimmings in the Piece, without Embroidery, other than Knitted or Crocheted; Tassels, Pompons and similar articles"
5809,"Fabrics, Woven; of Metal Thread and Metallised Yarn of Heading No. 5605, of a kind used in Apparel, as Furnishing Fabrics or similar purposes; n.e.s. or included"
5810,"Embroidery; in the Piece, in Strips or in Motifs"
5811,"Quilted Textile Products; in the Piece, Composed of one or more Layers of Textile Materials Assembled with Padding by Stitching or otherwise (excluding Embroidery of Heading No. 5810)"
5901,"Textile Fabrics, Gum or Amylaceous Sub- Stance Coated, used for Outer Book Covers and like; Tracing Cloth, prepared Painting Canvas; Buckram and similar Stiffened Textile Fabrics used for Hat Foundation"
5902,Textile Fabrics; Tyrecord of High Tenacity Yarn of Nylon or other Polyamides Polyesters or Viscose Rayon
5903,"Textile Fabrics Impregnated, Coated, Covered or Laminated with Plastics, other than those of Heading No. 5902"
5904,"Linoleum, whether or not cut to shape; Floor Coverings Consisting of a Coating or Covering Applied on a Textile Backing, whether or not cut to shape"
5905,Textile Wall Coverings
5906,"Textile Fabrics, Rubberised; other than those of Heading No. 5902"
5907,"Textile Fabrics; otherwise Impregnated, Coated or Covered; Painted Canvas being Theatrical Scenery, Studio Back-cloths or the like"
5908,"Textile Wicks, Woven, Plaited or Knitted; for Lamps, Stoves, Lighters, Candles or the like; Incandescent Gas Mantles and Tubular Knitted Gas Mantle Fabric Therefor, whether or not Impregnated"
5909,"Textile Hosepiping and similar Textile Tubing; with or without Lining, Armour or Accessories of other Materials"
5910,"Textiles; Transmission or Conveyor Belts or Belting, of Textile Material, whether or not Reinforced with Metal or other Material"
5911,Textile Products and articles for Technical uses; specified in Note 7 to this Chapter
6001,"Fabrics; Pile Fabrics, including ""long Pile"" Fabrics and Terry Fabrics, Knitted or Crocheted"
6002,"Fabrics; Knitted or Crocheted, other than those of Heading No. 6001"
6006,"Knitted or crocheted fabrics, n.e.s"
6101,"Coats; Men's or Boys' Overcoats, Car-coats, Capes, Cloaks, Anoraks, Ski-jackets, Wind- Cheaters, Wind-jackets and similar articles; Knitted or Crocheted, other than those of Heading No. 6103"
6102,"Coats; Women's or Girls' Overcoats, Car- Coats, Capes, Cloaks, Anoraks, Ski-jackets, Wind-cheaters, Wind-jackets and similar articles, Knitted or Crocheted, other than those of Heading No. 6104"
6103,"Suits, Ensembles, Jackets, Blazers, Trousers, Bib and Brace Overalls, Breeches, Shorts (not Swimwear); Men's or Boys', Knitted or Crocheted"
6104,"Suits, Ensembles, Jackets, Dresses, Skirts, Divided Skirts, Trousers, Bib and Brace Overalls, Breeches and Shorts (other than Swimwear), Women's or Girls', Knitted or Crocheted"
6105,"Shirts; Men's or Boys', Knitted or Crocheted"
