HS.Code_4,Description
8109,"Zirconium; articles thereof, including waste and Scrap"
8110,"Antimony; articles thereof, including waste and Scrap"
8111,"Manganese; articles thereof, including waste and Scrap"
8112,"Beryllium, Chromium, Germanium, Vanadium, Gallium, Hafnium, Indium, Niobium (columbium), Rhenium and Thallium; and articles of these Metals, including waste and Scrap"
8113,"Cermets; articles thereof, including waste and Scrap"
8149,Unknown
8201,"Tools, Hand; Spades, Shovels, Mattocks, Picks, Hoes, Forks, Rakes, Axes, Bill Hooks Etc., Secateurs, Scythes, Sickles, Hay Knives, Hedge Shears and other Tools used in Agriculture, Horticulture, Forestry"
8202,"Tools, Hand; Blades for Saws of All kinds (including Slitting, Slotting or Toothless Saw Blades)"
8203,"Tools, Hand; Files, Rasps, Pliers (including Cutting Pliers), Pincers, Tweezers, Metal Cutting Shears, Pipe Cutters, Bolt Croppers, Perforating Punches and similar"
8204,"Tools, Hand; Hand-operated Spanners and Wrenches (including Torque Meter Wrenches but not including Tap Wrenches), Interchangeable Spanner Sockets, with or without Handles"
8205,"Tools, Hand; (incl. Glaziers' Diamonds) n.e.s., Blow Lamps, Vices, Clamps Etc., not Accessories for or Parts of Machine Tools; Anvils, Portable Forges, Hand, Pedal Operated Grinding Wheels with Frameworks"
8206,"Tools, Hand; two or more of Heading No. 8202 to 8205, put up in Sets for Retail Sale"
8207,"Tools, Interchangeable; for Hand Tools, Power-operated or not, for Machine Tools (pressing, Stamping, Punching, Drilling Etc.), Dies for Drawing or Extruding Metal and Rock Drilling or Earth Boring Tools"
8208,"Knives and Cutting Blades, for Machines or for Mechanical Appliances"
8209,"Tools; Plates, Sticks, Tips and the like for Tools, Unmounted, of Sintered Metal Carbides or Cermets"
8210,"Tools; Hand-operated Mechanical Appliances, weighing 10kg or Less, used in Preparation, Conditioning or Serving of Food or Drink"
8211,"Knives; with Cutting Blades, Serrated or not (including Pruning Knives), other than Knives of Heading No. 8208, and Blades Therefor"
8212,Razors and Razor Blades; (including Razor Blade Blanks in Strips)
8213,"Scissors; Tailors' Shears and similar Shears, and Blades Therefor"
8214,"Cutlery; other articles, (e.g. Hair Clippers, Butchers' or Kitchen Cleavers, Choppers and Mincing Knives, Paper Knives), Manicure or Pedicure Sets and Instruments (including Nail Files)"
8215,"Cutlery; Spoons, Forks, Ladles, Skimmers, Cake-servers, Fish-knives, Butter Knives, Sugar Tongs and similar Kitchen or Tableware"
8301,"Padlocks and Locks (key, Combination, Electrically Operated) of Base Metal; Clasps and Frames with Clasps incorporating Locks, of Base Metal, Keys for any or the Foregoing articles, of Base Metal"
8302,"Base Metal Mountings, Fittings and similar articles for Furniture, Doors, Staircases, Windows, Trunks, Chests etc, Castors with Mountings of Base Metal, Automatic Door Closers of Base Metal"
8303,"Safes; Armoured or Reinforced, Strong- Boxes, Doors and Safe Deposit Lockers for Strong-rooms, Cash or Deed Boxes and the like, of Base Metal"
8304,"Office Equipment; Filing Cabinets, Card- Index Cabinets, Paper Trays and Rests, Pen Trays, Office-stamp Stands and the like, of Base Metal, other than Office Furniture of Heading No. 9403"
8305,"Stationery; Fittings for Loose-leaf Binders or Files, Letter Clips, Letter Corners, Paper Clips, Indexing Tags and the like, Staples in Strips (for Offices, Upholstery, Packaging), of Base Metal"
8306,"Bells, Gongs and the like; Non-electric, Statuettes, other Ornaments, Photograph, Picture, similar Frames, Mirrors, of Base Metal"
8307,"Tubing; Flexible, with or without Fittings, of Base Metal"
8308,"Clasps; Frames with Clasps, Buckles, Hooks, Eyes, Eyelets Etc. used for Clothing, Footwear, Awnings, Handbags, Travel Goods or other articles, Tubular, Bifurcated Rivets, Beads, Spangles, of Base Metal"
8309,"Stoppers, Caps, Lids (including Crown Corks, Screw Caps, Pouring Stoppers); Capsules for Bottles, Threaded Bungs, Bung Covers, Seals and other Packing Accessories, of Base Metal"
8310,"Sign Plates, Name Plates, Address Plates and similar Plates, Numbers, Letters and other Symbols, of Base Metal, excluding those of Heading No. 9405"
8311,"Wires, Rods, Tubes, Plates, Electrodes of Base Metal or Metal Carbides; of a kind used for Soldering, Brazing, Welding; Wires and Rods for Metal Spraying"
8401,"Nuclear Reactors; Fuel Elements (cartridges), Non-irradiated, for Nuclear Reactors, Machinery and Apparatus for Isotopic Separation"
8402,"Boilers; Steam or other Vapour Generating (other than Central Heating Hot Water Boilers, Capable Also of Producing Low Pressure Steam), Super Heated Water Boilers"
8403,Central Heating Boilers; other than those of Heading No. 8402
8404,"Auxiliary Plant for use with Boilers of Heading No. 8402 or 8403; e.g. Economisers, Super-heaters, Soot Removers, Gas Recoverers), Condensers for Steam or other Vapour Power Units"
8405,"Generators for Producer or Water Gas with or without their Purifiers; Acetylene Gas Generators and similar Water Process Gas Generators, with or without their Purifiers"
8406,Turbines; Steam and other Vapour Turbines
8407,Reciprocating or Rotary Internal Combustion Piston Engines; Spark-ignition
8408,Compression-ignition Internal Combustion Piston Engines (diesel or Semi-diesel Engines)
8409,Parts Suitable for use solely or Principally with the Engines of Heading No. 8407 or 8408
8410,Turbines; Hydraulic Water Wheels and Regulators Therefor
8411,"Turbo-jets, Turbo-propellers and other Gas Turbines"
8412,"Engines and Motors; n.e.s. (e.g. Reaction Engines, Hydraulic Power Engines, Pneumatic Power Engines)"
8413,"Pumps; for Liquids, whether or not Fitted with Measuring Device, Liquid Elevators"
8414,"Air or Vacuum Pumps, Air or other Gas Compressors and Fans; Ventilating or Recycling Hoods incorporating a Fan whether or not Fitted with Filters"
8415,"Air Conditioning Machines; Comprising a Motor Driven Fan and Elements for Changing the Temperature and Humidity, including those Machines in which the Humidity cannot be Separately Regulated"
8416,"Furnace Burners for Liquid Fuel, for Pulverised Solid Fuel or for Gas; Mechanical Grates, Mechanical Ash Dischargers and similar Appliances"
8417,"Furnaces and Ovens; Industrial or Laboratory, including Incinerators, Non- Electric"
8418,"Refrigerators, Freezers and other Refrigerating or Freezing Equipment, Electric or other; Heat Pumps other than Air Conditioning Machines of Heading No. 8415"
8419,"Machinery, Plant or Laboratory Equipment for the Treatment of Materials by a Process Involving Change of Temperature (i.e. Heating, Cooking, Etc.); Instantaneous or Storage Water Heaters, Non-electric"
8420,"Machines; Calendering or other Rolling Machines, for other than Metal or Glass and Cylinders Therefor"
8421,"Centrifuges, including Centrifugal Dryers; Filtering or Purifying Machinery and Apparatus for Liquids or Gases"
8422,"Dish Washing Machines; Machinery for Cleaning, Drying, Filling, Closing, Sealing, Capsuling or Labelling Bottles, Cans, Boxes, Bags, Etc., Machinery for Aerating Beverages"
8423,"Weighing Machines; excluding Balances of a Sensitivity of 5cg or Better, including Weight Operated Counting or Checking Machines and Weights of All kinds"
8424,"Mechanical Appliances for Projecting, Dispersing or Spraying Liquids or Powders; Fire Extinguishers, Spray Guns, Steam, Sand Blasting Machines"
8425,Pulley Tackle and Hoists other than Skip Hoists; Winches and Capstans; Jacks
8426,"Derricks, Cranes, including Cable Cranes, Mobile Lifting Frames, Straddle Carriers and Works Trucks Fitted with a Crane"
8427,Fork-lift and other Works Trucks; Fitted with Lifting or Handling Equipment
8428,"Lifting, Handling, Loading or Unloading Machinery (e.g. Lifts, Escalators, Conveyors, Teleferics)"
8429,"Bulldozers, Graders, Levellers, Scrapers, Angle-dozers, Mechanical Shovels, Excavators, Shovel Loaders, Tamping Machines and Road Rollers, Self-propelled"
8430,"Moving, Grading, Levelling, Scraping, Excavating, Tamping, Compacting, Extracting or Boring Machinery, for Earth, Minerals, or Ores; Pile Drivers and Extractors; Snow Ploughs and Snow Blowers"
8431,Machinery Parts; used solely or Principally with the Machinery of Heading No. 8425 to 8430
8432,"Agricultural, Horticultural or Forestry Machinery for Soil Preparation or Cultivation; Lawn or Sports-ground Rollers"
8433,"Harvesting and Threshing Machinery, Straw and Fodder Balers; Grass or Hay Mowers; Machines for Cleaning, Sorting or Grading Eggs, Fruit or other Agricultural Produce, other than Machinery of Heading No. 8437"
8434,Milking Machines and Dairy Machinery
8435,"Presses, Crushers and similar Machinery; used in the Manufacture of Wine, Cider, Fruit Juices or similar Beverages"
8436,"Agricultural, Horticultural, Forestry, Poultry-keeping, Bee-keeping Machinery; including Germination Plant Fitted with Mechanical or Thermal Equipment; Poultry Incubators and Brooders"
8437,"Machines for Cleaning, Sorting, Grading Seed, Grain, Dried Leguminous Vegetables; Machinery used in the Milling Industry for the Working of Cereals or Dried Leguminous Vegetables, not Farm Type Machinery"
8438,"Machinery n.e.s. in this Chapter, for the Industrial Preparation or Manufacture of Food or Drink; other than Machinery for Extraction or Preparation of Animal or Fixed Vegetable Fats or Oils"
8439,"Machinery; for making Pulp of Fibrous Cellulosic Material, or for making or Finishing Paper or Paperboard"
8440,Book-binding Machinery; including Book Sewing Machines
8441,"Machines; for making up Paper Pulp, Paper or Paperboard, including Cutting Machines of All kinds"
8442,"Machinery and Apparatus; for Type Founding or Type-setting (excluding Machine Tools of Heading No. 8456 to 8465), Printing Type, Blocks, Plates, Cylinders and Lithographic Stones"
8443,Printing Machinery; Machines for uses Ancillary to Printing
8444,"Textile Machinery; for Extruding, Drawing, Texturing or Cutting Man-made Textile Materials"
8445,"Textile Machinery; Spinning, Doubling, Twisting Machines, Textile Reeling or Winding Machines and Machines for preparing Textile Yarns for use on Machines of Heading No. 8446 and 8447"
8446,Weaving Machines (looms)
8447,"Knitting Machines, Stitch-bonding Machines and Machines for making Gimped Yarn, Tulle, Lace, Embroidery, Trimmings, Braid or Net and Machines for Tufting"
8448,"Machinery, Auxiliary; for use with Machines of Heading No. 8444 to 8447 (eg. Dobbies, Jaquards, Automatic Stop Motions, Shuttle Changing Mechanisms) Parts, Accessories for Machines of Heading No. 8444 to 8447"
8449,"Machinery; for Manufacture or Finishing Felt or Non-wovens in the Piece or in shapes, including Machinery for making Felt Hats, Blocks for making Hats"
8450,Household or Laundry-type Washing Machines; including Machines which Both Wash and Dry
8451,"Machinery (not of Heading No. 8450) for Washing, Cleaning, Wringing, Drying, Iron- Ing, Pressing, Bleaching, Dyeing, Dressing, Finishing, Coating or Impregnating Textile Yarn, Fabrics or made up articles"
8452,"Sewing Machines; other than Book-sewing Machines of Heading No. 8440 Furniture, Bases and Covers Specially Designed for Sewing Machines, Sewing Machine Needles"
8453,"Machinery for preparing, Tanning or Working Hides, Skins or Leather or for making or Repairing Footwear or other articles of Hides, Skins or Leather, other than Sewing Machines"
8454,"Converters, Ladles, Ingot Moulds and Casting Machines; of a kind used Metallurgy or in Metal Foundries"
8455,Metal-rolling Mills and Rolls Therefor
8456,"Machine-tools; for Working any Material by Removal of Material, by Laser, other Light or Photon Beam, Ultrasonic, Electro- Discharge, Electro-chemical, Electron Beam, Ionic Beam or Plasma Arc Processes"
8457,"Machining Centres, Unit Construction Machines (single Station) and Multi- Station Transfer Machines for Working Metal"
8458,Lathes for Removing Metal
8459,"Machine-tools; (including Way-type Unit Head Machines) for Drilling, Boring, Milling, Threading or Tapping by Removing Metal, other than Lathes of Heading No. 8458"
8460,"Machine-tools; for Deburring, Sharpening, Grinding, Honing, Lapping, Polishing or otherwise Finishing Metal, Sintered Metal Carbides or Cermets by Means of Grinding Stones, Abrasives or Polishing Products"
8461,"Machine-tools; for Planing, Shaping, Slotting, Broaching, Gear Cutting and Grinding, Finishing, Sawing, Cutting off and other Tools Working by Removing Metal, Sintered Metal Carbides or Cermets n.e.s."
8462,"Machine-tools; (including Presses) for Working Metal by Forging, Hammering or Die- Stamping, for Bending, Folding, Straightening, Flattening, Shearing or Punching Metal"
8463,"Machine-tools; n.e.s. for Working Metal, Sintered Metal Carbides or Cermets without Removing Material"
8464,"Machine-tools; for Working Stone, Ceramics, Concrete, Asbestos-cement or like Mineral Materials or for Cold Working Glass"
8465,"Machine-tools (including Machines for Nailing, Stapling, Glueing or otherwise Assembling) for Working Wood, Cork, Bone, Hard Plastics or Rubber or similar Hard Materials"
8466,"Machine-tool; Parts Suitable for use with the Machines of Heading No. 8456 to 8465, Work or Tool Holders, Self-opening Dieheads, Dividing Heads and other Attachments"
8467,"Tools; for Working in the Hand, Pneumatic or with Self-contained Non-electric Motor"
8468,"Machinery and Apparatus for Soldering, Brazing, Welding, whether or not Capable of Cutting, other than those of Heading No. 8515; Gas-operated Surface Tempering Machines and Appliances"
8469,Typewriters and Word-processing Machines
8470,"Calculating Machines, Accounting Machines, Cash Registers, Postage Franking Machines, Ticket-issuing Machines and similar Machines, incorporating a Calculating Device"
8471,"Automatic Data Processing Machines and Units thereof; Magnetic or Optical Readers, Machines for Transcribing Data onto Data Media in Coded form and Machines for Processing such Data n.e.s."
8472,"Office Machines n.e.s.; Hectograph, Stencil Duplicating Machines, Addressing Machines, Automatic Banknote Dispensers, Coin Sorting Machines, Pencil Sharpening Machines, Stapling Machines"
8473,"Machinery; Parts and Accessories (not Covers, Carrying Cases and the Like) Suitable for use solely, Principally with Machines of Heading No. 8469 to 8472"
8474,"Machinery for Sorting, Screening, Separating, Washing, Crushing, Grinding, Mixing or Kneading Earth, Stone, Ores in Solid form, Shaping, Moulding Machinery for Solid Mineral Fuels"
8475,"Machines; for Assembling Electric or Electronic Lamps, Tubes, Valves, Flashbulbs, in Glass Envelopes, Machines for Manufacturing or Hot Working Glass or Glassware"
8476,"Automatic Goods-vending Machines (e.g. Postage Stamp, Cigarette, Food or Beverage Machines), including Money-changing Machines"
8477,"Machinery; for Working Rubber or Plastics or for the Manufacture of Products from these Materials, n.e.s. in this Chapter"
8478,"Machinery; for preparing or making up Tobacco, n.e.s. in this Chapter"
8479,"Machinery and Mechanical Appliances; having Individual Functions, n.e.s. in this Chapter"
8480,"Moulding Boxes for Metal Foundry, Moulding Patterns, Moulds for Metals (excluding Ingot Moulds), Metal Carbides, Glass, Mineral Materials, Rubber or Plastics"
8481,"Taps, Cocks, Valves and similar Appliances for Pipes, Boiler Shells, Tanks, Vats or the like, including Pressure-reducing Valves and Thermostatically Controlled Valves"
8482,Ball or Roller Bearings
8483,"Transmission Shafts (including Cam and Crank); Bearing Housings and Plain Shaft Bearings, Gears and Gearing, Ball Screws, Gear Boxes, Flywheels and Pulleys, Clutches"
8484,"Gaskets and similar Joints of Metal Sheeting Combined with other Material; Sets or Assortments of Gaskets and the like, Dissimilar in Composition, put in Pouches, Envelopes or the like"
8485,"Machinery Parts; not containing Electrical Connectors, Insulators, Coils, Contacts or other Electrical Features, n.e.s. in this Chapter"
8501,Electric Motors and Generators (excluding Generating Sets)
8502,Electric Generating Sets and Rotary Converters
8503,Electric Motors and Generators; Parts Suitable for use solely or Principally with the Machines of Heading No. 8501 or 8502
8504,"Electric Transformers, Static Converters (e.g. Rectifiers) and Inductors"
8505,"Electro-magnets; Permanent Magnets, Intend- Ed Permanent Magnets; Electro-magnetic, Permanent Magnet Chucks, Clamps, similar; Electro-magnetic Couplings, Clutches, Brakes; Electro-magnetic Lifting Heads"
8506,Cells and Batteries; primary
8507,"Electric Accumulators, including Separators Therefor; whether or not Rectangular (including Square)"
8508,"Electro-mechanical Tools; for Working in the Hand, Self-contained Electric Motor"
8509,Electro-mechanical Domestic Appliances; with Self-contained Electric Motor
8510,Shavers and Hair Clippers; with Self- Contained Electric Motor
8511,Ignition or Starting Equipment; used for Spark-ignition or Compression-ignition Internal Combustion Engines; Generators and cut Outs used in Conjunction with such Engines
8512,"Lighting or Visual Signalling Equipment (excluding articles of Heading No. 8539), Windscreen Wipers, Defrosters and Demisters; Electrical, of a kind used for Cycles or Motor Vehicles"
8513,"Lamps; Portable Electric, Designed to Function by their Own Source of Energy (e.g. Dry Batteries, Accumulators, Magnetos), excluding Lighting Equipment of Heading No. 8512"
8514,"Industrial or Laboratory Electric (including Induction or Dielectric) Furnaces, Ovens, other Induction or Dielectric Heating Equipment"
8515,"Electric (electrically Heated Gas) Soldering, Brazing, Welding Machines and Apparatus, Capable or not of Cutting, Electric Machines and Apparatus for Hot Spraying of Metals or Sintered Carbides"
8516,"Electric Water, Space, Soil Heaters; Electro-thermic Hair-dressing Apparatus; Hand Dryers, Irons; Electro-thermic Appliances for Domestic purposes; Electric Heating Resistors, not of Heading No. 8545"
8517,Line Telephony or Line Telegraphy Apparatus; including such Apparatus for Carrier-current Line Systems
8518,"Microphones and Stands Therefor; Loudspeakers, Mounted or not in Enclosures; Headphones, Earphones, Microphone-speaker Sets; Audio Frequency Electric Amplifiers; Electric Sound Amplifier Sets"
8519,"Turntables, Record Players, Cassette- Players and other Sound Reproducing Apparatus; not incorporating a Sound Recording Device"
8520,Magnetic Tape Recorders and other Sound Recording Apparatus; whether or not incorporating a Sound Reproducing Device
8521,Video Recording or Reproducing Apparatus
8522,Sound or Video Recording Apparatus; Parts thereof of Apparatus of Heading No. 8519 to 8521
8523,"Media, Unrecorded; prepared, for Sound Recording or similar Recording of other Phenomena, (excluding Products of Chapter 37)"
8524,"Records, Tapes and other Recorded Media for Sound or other similarly Recorded Phenomena; including Matrices and Masters for Record Production, excluding Products of Chapter 37"
8525,"Transmission Apparatus for Radio-telephony, Radio-telegraphy, Radio-broadcasting or Television, whether or not incorporating Reception, Sound Recording or Reproducing Apparatus; Television Cameras"
8526,"Radar Apparatus, Radio Navigational Aid Apparatus and Radio Remote Control Apparatus"
8527,"Radio-telephony, Radio-telegraphy or Radio- Broadcasting Reception Apparatus; whether or not Combined with Sound Recording, Reproducing Apparatus or a Clock, in the Same Housing"
8528,"Television Receivers (including Video Monitors and Projectors); Combined or not in the Same Housing with Radio-broadcast Receivers, Sound or Video Recording or Reproducing Apparatus"
8529,Transmission Apparatus; Parts Suitable for use solely or Principally with the Apparatus of Heading No. 8525 to 8528
8530,"Signalling, Safety or Traffic Control Equipment; for Railways, Tramways, Roads, Inland Waterways, Parking Facilities, Port Installations, Airfields, excluding those of Heading No. 8608"
8531,"Signalling Apparatus; Electric Sound or Visual (e.g. Bells, Sirens, Indicator Panels, Burglar or Fire Alarms), excluding those of Heading No. 8512 or 8530"
8532,"Electrical Capacitors; Fixed, Variable or Adjustable (pre-set)"
8533,"Electrical Resistors (including Rheostats and Potentiometers), excluding Heating Resistors"
8534,Circuits; Printed
8535,"Electrical Apparatus for Switching, Protecting Electrical Circuits, for making Connections to or in Electrical Circuits; for a Voltage exceeding 1000 Volts"
8536,"Electrical Apparatus for Switching, Protecting Electrical Circuits, for making Connections to or in Electrical Circuits, for a Voltage not exceeding 1000 Volts"
8537,"Boards, Panels, Consoles, Desks, Cabinets, Bases with Apparatus of Heading No. 8535, 8536 for Electricity Control and Distribution, not Switching Apparatus of Heading No. 8517"
8538,"Electrical Apparatus; Parts Suitable for use solely or Principally with the Apparatus of Heading No. 8535, 8536 and 8537"
8539,"Lamps; Electric Filament or Discharge Lamps, including Sealed Beam Lamp Units and Ultra-violet or Infra-red Lamps, Arc-lamps"
8540,"Thermionic, Cold Cathode or Photo-cathode Valves and Tubes (e.g. Vacuum, Vapour, Gas Filled Valves and Tubes, Mercury Arc Rectifying Valves and Tubes, Cathode- Ray and Television Camera Tubes)"
8541,"Diodes, Transistors, similar Semiconductor Devices; including Photovoltaic Cells Assembled or not in Modules, Panels, Light Emitting Mounted Piezo-electric Crystals"
8542,Electronic Integrated Circuits and Microassemblies
8543,"Electrical Machines and Apparatus; having Individual Functions, not specified or included elsewhere in this Chapter"
8544,"Insulated Wire, Cable and other Electric Conductors, Connector Fitted or not; Optical Fibre Cables of Individually Sheathed Fibres, Assembled with Electric Conductors, Fitted with Connectors or not"
8545,"Carbon Electrodes, Carbon Brushes, Lamp Carbons, Battery Carbons and other articles of Graphite or other Carbon; with or without Metal, of a kind used for Electrical purposes"
8546,Electrical Insulators of any Material
8547,"Insulating Fittings; for Electrical Machines, Appliances, Equipment, excluding Insulators of Heading No. 8546, Electrical Conduit Tubing and Joints Therefor"
8548,"Electrical Parts; of Machinery or Apparatus, not specified or included elsewhere in Chapter 85"
8598,Unknown
8601,Rail Locomotives; Powered from an External Source of Electricity or by Electric Accumulators
8602,Rail Locomotives; other than those of Heading No. 8601; Locomotive Tenders
8603,"Railway or Tramway Coaches, Vans and Trucks; Self-propelled Tenders, other than those of Heading No. 8604"
8604,"Railway or Tramway Maintenance or Service Vehicles; whether or not Self-propelled (e.g. Workshops, Cranes, Ballast Tampers, Trackliners, Testing Coaches and Track Inspection Vehicles)"
8605,"Railway or Tramway Coaches; Passenger Coaches, Luggage Vans, Post Office Coaches and other Special Purpose Railway or Tramway Coaches, not Self-propelled (excluding those of Heading No. 8604)"
8606,Railway or Tramway Goods Vans and Wagons; not Self-propelled
8607,Railway or Tramway Locomotives or Rolling Stock; Parts thereof
8608,"Railway or Tramway Track Fixtures and Fittings; Parts, Mechanical (electro- Mechanical) Signalling, Safety, Traffic Control Equipment for Railway, Tramway, Roads, Inland Waterways, Parking Facilities"
8609,Containers; (including Containers for Transport of Fluids) Specially Designed and Equipped for Carriage by one or more Modes of Transport
8701,Tractors; (other than Tractors of Heading No. 8709)
8702,Vehicles; Public Transport Passenger Type
8703,"Motor Cars and other Motor Vehicles; Principally Designed for the Transport of Persons (other than those of Heading No. 8702), including Station Wagons and Racing Cars"
8704,Vehicles; for the Transport of Goods
8705,"Special Purpose Motor Vehicles; not those for the Transport of Persons or Goods (e.g. Breakdown Lorries, Road Sweeper Lorries, Spraying Lorries, Mobile Workshops, Mobile Radiological Units Etc.)"
8706,"Chassis; Fitted with Engines, for the Motor Vehicles of Heading No. 8701 to 8705"
8707,Bodies; (including Cabs) for the Motor Vehicles of Heading No. 8701 to 8705
8708,"Motor Vehicles; Parts and Accessories, of Heading No. 8701 to 8705"
8709,"Works Trucks, Self-propelled, not Fitted with Lifting or Handling Equipment for Factories, Warehouses etc, for Short Distance Transport of Goods, Tractors used on Railway Station Platforms; Parts thereof"
8710,"Tanks and other Armoured Fighting Vehicles; Motorised, whether or not Fitted with Weapons, and Parts of such Vehicles"
8711,"Motorcycles (including Mopeds) and Cycles; Fitted with an Auxiliary Motor, with or without Side-cars; Side-cars"
8712,"Bicycles and other Cycles; including Delivery Tricycles, not Motorised"
8713,Invalid Carriages; whether or not Motorised or otherwise Mechanically Propelled
8714,Vehicles; Parts and Accessories of Heading No. 8711 to 8713
8715,Baby Carriages and Parts thereof
8716,"Trailers and Semi-trailers; other Vehicles, not Mechanically Propelled; Parts thereof"
8801,"Aircraft, Non-powered; Balloons, Dirigibles, Gliders, Hang-gliders and the like"
8802,"Aircraft; (e.g. Helicopters, Aeroplanes), Space Craft (including Satellites) and Spacecraft Launch Vehicles"
8803,Aircraft; Parts of Heading No. 8801 or 8802
8804,Parachutes (including Dirigible) and Rotochutes; Parts and Accessories
8805,"Aircraft Launching Gear, Deck-arrestor or similar Gear, Ground Flying Trainers; Parts of the Foregoing articles"
8863,Unknown
8901,"Cruise Ships, Excursion Boats, Ferry-boats, Cargo Ships, Barges and similar Vessels for the Transport of Persons or Goods"
