HS.Code_4,Description
2516,"Granite, Porphyry, Basalt, Sandstone, other Monumental and Building Stone, whether or not Roughly Trimmed, cut, by Sawing Etc., into Blocks or Slabs of a Rectangular (including Square) shape"
2517,"Pebbles, Gravel, Crushed Stone for Concrete Aggregates for Road or Railway Ballast, Shingle or Flint; Macadam of Slag, Dross Etc. Tarred Granules, Chippings, powder of Stones of Heading No. 2515 and 2516"
2518,"Dolomite, whether or not Calcined; Dolomite Roughly Trimmed, cut by Sawing Etc. into Blocks or Slabs of Rectangular (including Square) shape; Agglomerated Dolomite (including Tarred Dolomite)"
2519,"Natural Magnesium Carbonate (magnesite); Fused Magnesia; Dead-burned (sintered) Magnesia, whether or not containing Small Quantities of other Oxides added Before Sintering; Magnesium Oxide, Pure or not"
2520,"Gypsum; Anhydrite; Plasters (consisting of Calcined Gypsum or Calcium Sulphate), Coloured or not, with or without Small Quantities of Accelerators or Retarders"
2521,"Limestone Flux; Limestone and other Calcareous Stone, of a kind used for the Manufacture of Lime or Cement"
2522,"Quicklime, Slaked Lime and Hydraulic Lime; other than Calcium Oxide and Hydroxide of Heading No. 2825"
2523,"Portland Cement, Aluminous Cement, Slag Cement, Supersulphate Cement and similar Hydraulic Cements; whether or not Coloured or in the form of Clinkers"
2524,Asbestos
2525,"Mica, including Splittings; Mica waste"
2526,"Natural Steatite; whether or not Roughly Trimmed or merely cut, by Sawing or otherwise, into Blocks or Slabs of a Rectangular (including Square) shape; Talc"
2527,Natural Cryolite; Natural Chiolite
2528,"Natural Borates and Concentrates thereof (whether Calcined), but not including Borates Separated from Natural Brine; Natural Boric Acid containing not Less than 85% of H3bo3, Calculated on the Dry Weight"
2529,Felspar; Leucite; Nepheline and Nepheline Syenite; Fluorspar
2530,Mineral Substances not elsewhere specified or included
2601,Iron Ores and Concentrates; including Roasted Iron Pyrites
2602,"Manganese Ores and Concentrates; including Manganiferous Iron Ores and Concentrates with a Manganese Content of 20% or more, Calculated on the Dry Weight"
2604,Nickel Ores and Concentrates
2605,Cobalt Ores and Concentrates
2606,Aluminium Ores and Concentrates
2607,Lead Ores and Concentrates
2608,Zinc Ores and Concentrates
2609,Tin Ores and Concentrates
2610,Chromium Ores and Concentrates
2611,Tungsten Ores and Concentrates
2612,Uranium or Thorium Ores and Concentrates
2613,Molybdenum Ores and Concentrates
2614,Titanium Ores and Concentrates
2615,"Niobium, Tantalum, Vanadium or Zirconium Ores and Concentrates"
2616,Precious Metal Ores and Concentrates
2617,Ores and Concentrates; n.e.s. in Chapter 26
2618,Granulated Slag (slag Sand) from the Manufacture of Iron or Steel
2619,"Slag, Dross; (other than Granulated Slag), Scalings and other waste from the Manufacture of Iron or Steel"
2620,Ash and Residues (not from the Manufacture of Iron or Steel) containing Metals or Metallic Compounds
2621,"Slag and Ash, including Seaweed Ash (kelp), n.e.s. in Chapter 26"
2701,"Coal; Briquettes, Ovoids and similar Solid Fuels Manufactured from Coal"
2702,"Lignite; whether or not Agglomerated, excluding Jet"
2703,Peat (including Peat Litter); whether or not Agglomerated
2704,"Coke and Semi-coke; of Coal, Lignite or Peat, whether or not Agglomerated; Retort Carbon"
2705,"Coal Gas, Water Gas, Producer Gas and similar Gases, other than Petroleum Gases and other Gaseous Hydrocarbons"
2706,"Tar Distilled from Coal, from Lignite, Peat and other Mineral Tars, whether or not Dehydrated or Partially Distilled; including Reconstituted Tars"
2707,Oils and other Products of the Distillation of High Temperature Coal Tar; similar Products in which the Weight of the Aromatic Constituents exceeds that of the Non-aromatic Constituents
2708,Pitch and Pitch Coke; Obtained from Coal Tar or from other Mineral Tars
2709,Petroleum Oils and Oils Obtained from Bituminous Minerals; Crude
2710,"Petroleum Oils, Oils from Bituminous Minerals, not Crude; preparations n.e.s. containing 70% or more of Petroleum Oils, Oils from Bituminous Minerals; these being the Basic Constituents of the preparations"
2711,Petroleum Gases and other Gaseous Hydrocarbons
2712,"Petroleum Jelly; Paraffin Wax, Micro- Crystalline Petroleum Wax, Slack Wax, Ozokerite, Lignite Wax, Peat Wax, other Mineral Waxes, similar Products Obtained by Synthesis, other Processes; Coloured or not"
2713,"Petroleum Coke, Petroleum Bitumen; other Residues of Petroleum Oils or Oils Obtained from Bituminous Minerals"
2714,"Bitumen and Asphalt, Natural; Bituminous or Oil Shale and Tar Sands; Asphaltites and Asphaltic Rocks"
2715,"Bituminous Mixtures Based on Natural Asphalt; on Natural Bitumen, on Petroleum Bitumen, on Mineral Tar or on Mineral Tar Pitch (e.g. Bituminous Mastics, Cut-backs)"
2801,"Fluorine, Chlorine, Bromine and Iodine"
2802,Sulphur; Sublimed or Precipitated; Colloidal Sulphur
2803,Carbon; Carbon Blacks and other forms of Carbon n.e.s.
2804,"Hydrogen, Rare Gases and other Non-metals"
2805,"Alkali or Alkaline-earth Metals; Rare-earth Metals, Scandium and Yttrium, whether or not Intermixed or Interalloyed; Mercury"
2806,Hydrogen Chloride (hydrochloric Acid); Chlorosulphuric Acid
2807,Sulphuric Acid; Oleum
2808,Nitric Acid; Sulphonitric Acids
2809,Diphosphorus Pentaoxide; Phosphoric Acid an Polyphosphoric Acids
2810,Oxides of Boron; Boric Acids
2811,Inorganic Acids and other Inorganic Oxygen Compounds of Non-metals; n.e.s. in Heading No. 2806 to 2810
2812,Halides and Halide Oxides of Non-metals
2813,Sulphides of Non-metals; Commercial Phosphorus Trisulphide
2814,Ammonia; Anhydrous or in Aqueous Solution
2815,Sodium Hydroxide (caustic Soda); Potassium Hydroxide (caustic Potash) Peroxides of Sodium or Potassium
2816,"Hydroxide and Peroxide of Magnesium; Oxides, Hydroxides and Peroxides of Strontium or Barium"
2817,Zinc; Oxide and Peroxide
2818,Aluminium Oxide (including Artificial Corundum); Aluminium Hydroxide
2819,Chromium Oxides and Hydroxides
2820,Manganese Oxides
2821,Iron Oxides and Hydroxides; Earth Colours containing 70% or more by Weight of Combined Iron Evaluated as Fe203
2822,Cobalt Oxides and Hydroxides; Commercial Cobalt Oxides
2823,Titanium Oxides
2824,Lead Oxides; Red Lead and Orange Lead
2825,"Hydrazine and Hydroxylamine and their Inorganic Salts; other Inorganic Bases; other Metal Oxides, Hydroxides and Peroxides"
2826,"Fluorides; Fluorosilicates, Fluoroaluminates and other Complex Fluorine Salts"
2827,Chlorides; Chloride Oxides and Chloride Hydroxides; Bromides and Bromide Oxides; Iodides and Iodide Oxides
2828,Hypochlorites; Commercial Calcium Hypochlorite; Chlorites; Hypobromites
2829,Chlorates and Perchlorates; Bromates and Perbromates; Iodates and Periodates
2830,Sulphides; Polysulphides
2831,Dithionites and Sulphoxylates
2832,Sulphites; Thiosulphates
2833,Sulphates; Alums; Peroxosulphates (persulphates)
2834,Nitrites; Nitrates
2835,"Phosphinates (hypophosphites), Phosphonates (phosphites), Phosphates and Polyphosphates"
2836,Carbonates; Peroxocarbonates (percarbonates); Commercial Ammonium Carbonate containing Ammonium Carbamate
2837,"Cyanides, Cyanide Oxides and Complex Cyanides"
2838,"Fulminates, Cyanates and Thiocyanates"
2839,Silicates; Commercial Alkali Metal Silicates
2840,Borates; Peroxoborates (perborates)
2841,Salts of Oxometallic or Peroxometallic Acids
2842,"Salts of Inorganic Acids or Peroxoacids, excluding Azides, n.e.s."
2843,"Colloidal Precious Metals; Inorganic or Organic Compounds of Precious Metals, whether or not Chemically Defined; Amalgams of Precious Metals"
2844,Radioactive Chemical Elements and Radioactive Isotopes (including the Fissile or Fertile Chemical Elements and Isotopes); and their Compounds; Mixtures and Residues containing these Products
2845,"Isotopes other than those of Heading No. 2844; Compounds, Inorganic or Organic, of such Isotopes, whether or not Chemically Defined"
2846,"Compounds, Inorganic or Organic, of Rare- Earth Metals; of Yttrium or of Scandium or of Mixtures of these Metals"
2847,Hydrogen Peroxide; whether or not Solidified with Urea
2848,"Phosphides; whether or not Chemically Defined, not Ferrophosphorus"
2849,"Carbides, whether or not Chemically Defined"
2850,"Hydrides, Nitrides, Azides, Silicides and Borides, whether or not Chemically Defined"
2851,"Inorganic Compounds n.e.s. (incl. Distilled or Conductivity Water and Water of similar Purity); Liquid Air (whether or not Rare Gases Have Been Removed); Compressed Air; Amalgams, not of Precious Metals"
2901,Acyclic Hydrocarbons
2902,Cyclic Hydrocarbons
2903,Halogenated Derivatives of Hydrocarbons
2904,"Sulphonated, Nitrated or Nitrosated Derivatives of Hydrocarbons; whether or not Halogenated"
2905,"Acyclic Alcohols and their Halogenated, Sulphonated, Nitrated or Nitrosated Derivatives"
2906,"Alcohols; Cyclic, and their Halogenated, Sulphonated, Nitrated or Nitrosated Derivatives"
2907,Phenols; Phenol-alcohols
2908,"Phenols or Phenol-alcohols; Halogenated, Sulphonated, Nitrated or Nitrosated Derivatives thereof"
2909,"Ethers, Ether-alcohols, Ether-phenols, Ether-alcohol-phenols, Alcohol Peroxides, Ether Peroxides, Ketone Peroxides (chemically Defined or Not); Halogenated, Sul- Phonated, Nitrated, Nitrosated Derivative"
2910,"Epoxides, Epoxyalcohols, Epoxyphenols and Epoxyethers; with a Three-membered Ring and their Halogenated, Sulphonated, Nitrated or Nitrosated Derivatives"
2911,"Acetals and Hemiacetals; whether or not with other Oxygen Function, and their Halogenated, Sulphonated, Nitrated or Nitrostated Derivatives"
2912,"Aldehydes, whether or not with other Oxygen Function; Cyclic Polymers of Aldehydes; Paraformaldehyde"
2913,"Aldehydes; Halogenated, Sulphonated, Nitrated or Nitrosated Derivatives of Products of Heading No. 2912"
2914,"Ketones and Quinones; whether or not with other Oxygen Function, and their Halogenated, Sulphonated, Nitrated or Nitrosated Derivatives"
2915,"Acids; Saturated Acyclic Monocarboxylic Acids and their Anhydrides, Halides, Peroxides and Peroxyacids; their Halogenated, Sulphonated, Nitrated or Nitrosated Derivatives"
2916,"Acids; Unsaturated Acyclic Monocarboxylic, Cyclic Monocarboxylic, their Anhydrides, Halides, Peroxides, Peroxyacids; their Halogenated, Sulphonated, Nitrated or Nitrosated Derivatives"
2917,"Acids; Polycarboxylic Acids, their Anhydrides, Halides, Peroxides and Peroxy- Acids; their Halogenated, Sulphonated, Nitrated or Nitrosated Derivatives"
2918,"Acids; Carboxylic Acid with Additional Oxygen Function and their Anhydrides, Halides, Peroxides, Peroxyacids; their Halogenated, Sulphonated, Nitrated or Nitrosated Derivatives"
2919,"Esters; Phosphoric; and their Salts, including Lactophosphates; their Halogenated, Sulphonated, Nitrated or Nitrosated Derivatives"
2920,"Esters of other Inorganic Acids (not Esters of Hydrogen Halides) and their Salts; their Halogenated, Sulphonated, Nitrated or Nitrosated Derivatives"
2921,Amine-function Compounds
2922,Oxygen-function Amino-compounds
2923,Quaternary Ammonium Salts and Hydroxides; Lecithins and other Phosphoaminolipids
2924,Carboxyamide-function Compounds; Amide- Function Compounds of Carbonic Acid
2925,Carboxyimide-function Compounds (including Saccharin and Its Salts) and Imine-function Compounds
2926,Nitrile-function Compounds
2927,"Diazo-, Azo- or Azoxy-compounds"
2928,Organic Derivatives of Hydrazine or of Hydroxylamine
2929,"Nitrogen-function Compounds, other"
2930,Organo-sulphur Compounds
2931,"Organo-inorganic Compounds; other, n.e.s. in Heading No. 2930"
2932,Heterocyclic Compounds with Oxygen Hetero- Atom(s) only
2933,Heterocyclic Compounds with Nitrogen Hetero-atom(s) only; Nucleic Acids and their Salts
2934,Heterocyclic Compounds; n.e.s. in Chapter 29
2935,Sulphonamides
2936,"Provitamins, Vitamins; Natural or Reproduced by Synthesis (including Natural Concentrates) Derivatives thereof used as Vitamins, and Intermixtures of the Fore- Going, whether or not in any Solvent"
2937,"Hormones, Natural or Reproduced by Synthesis; Derivatives thereof, used primarily as Hormones; other Steroids used primarily as Hormones"
2938,"Glycosides, Natural or Reproduced by Synthesis, and their Salts, Ethers, Esters and other Derivatives"
2939,"Alkaloids, Vegetable; Natural or Reproduced by Synthesis, and their Salts, Ethers, Esters and other Derivatives"
2940,"Sugars, Chemically Pure, not Sucrose, Lactose, Maltose, Glucose or Fructose; Sugar Ethers and Sugar Esters and their Salts, other than Products of Heading No. 2937, 2938 or 2939"
2941,Antibiotics
2942,Organic Compounds; n.e.s. in Chapter 29
3001,"Glands, Organs (extracts, Secretions Thereof) for Organo-therapeutic uses, Dried, Powdered or not; Heparin and Its Salts; other Human or Animal Substances for Therapeutic or Prophylactic uses N.e.s"
3002,"Blood; Human or Animal; prepared for Therapeutic, Prophylactic, Diagnostic uses; Antisera and other Blood Fractions; Vac- Cines, Toxins, Cultures of Micro-organisms and similar Products (excluding Yeasts)"
3003,"Medicaments; (not Goods of Heading No. 3002, 3005 or 3006) of two or more Constituents Mixed Together for Therapeutic or Prophylactic use, not in Measured Doses or in forms or Packings for Retail Sale"
3004,"Medicaments; (not Goods of Heading No. 3002, 3005 or 3006) Consisting of Mixed or Unmixed Products for Therapeutic or Prophylactic use, put up in Measured Doses or in forms or Packings for Retail Sale"
3005,"Wadding, Gauze, Bandages (dressings, Adhesive Plasters, Poultices), Impregnated or Coated with Pharmaceutical Substances or in forms or Packings for Retail Sale, for Medical, Surgical or Veterinary use"
3006,Pharmaceutical Goods
3101,"Fertilizers; Animal or Vegetable, whether or not Mixed Together or Chemically Treated; Fertilizers produced by the Mixing or Chemical Treatment of Animal or Vegetable Products"
3102,"Fertilizers; Mineral or Chemical, Nitrogenous"
3103,"Fertilizers; Mineral or Chemical, Phosphatic"
3104,"Fertilizers; Mineral or Chemical, Potassic"
3105,"Fertilizers; Mineral, Chemical, containing 2 or 3 of the Elements Nitrogen, Phosphorus, Potassium; other Fertilisers; Goods of Chapter 31 in Tablets or Packages of Gross Weight not exceeding 10 Kg"
3201,"Tanning Extracts of Vegetable Origin; Tannins and their Salts, Ethers, Esters and other Derivatives"
3202,"Tanning Substances; Synthetic Organic or Inorganic Tanning Substances; Tanning preparations, whether or not containing Natural Tanning Substances, Enzymatic preparations for Pre-tanning"
3203,"Colouring Matter of Vegetable or Animal Origin (including Dyeing Extracts, not Animal Black); whether or not Chemically Defined; preparations Based on Colouring Matter of Vegetable or Animal Origin"
3204,Synthetic Organic Colouring Matter and preparations Based thereon; Synthetic Organic Products used as Fluorescent Brightening Agents or as Luminophores; whether or not Chemically Defined
3205,Colour Lakes; preparations Based on Colour Lakes as specified in Note 3 to this Chapter
3206,"Colouring Matter and preparations thereof n.e.s. in Heading No. 3203, 3204, 3205; Inorganic Products, kind used as Luminophores whether or not Chemically Defined"
3207,"Pigments, prepared; Opacifiers, Colours, Vitrifiable Enamels, Glazes, Engobes (slips), Liquid Lustres etc as used in the Ceramic Enamelling or Glass Industry; Glass Frit and powder, Granules or Flakes"
3208,"Paints, Varnishes; (enamels and Lacquers) Based on Synthetic Polymers or Chemically Modified Natural Polymers, Dispersed or Dissolved in a Non-aqueous Medium"
3209,"Paints and Varnishes (including Enamels and Lacquers) Based on Synthetic or Chemically Modified Natural Polymers, Dispersed or Dissolved in an Aqueous Medium"
3210,"Paints and Varnishes (including Enamels, Lacquers and Distempers), excluding those of Heading No. 3209) prepared Water Pigments of a kind used for Finishing Leather"
3211,"Driers, prepared"
3212,"Pigments (metallic Powders and Flakes) Dispersed in Non-aqueous Media, in Liquid O Paste form, as used in Manufacture of Paints (including Enamels); Stamping Foils, Dyes Etc. in forms, Packing for Retail Sale"
3213,"Colours; Artists, Students, or Signboard Painters, Modifying Tints, Amusement Colours and the like; in Tablets, Tubes, Jars, Bottles, Pan or in similar forms or Packings"
3214,"Glaziers Putty, Grafting Putty, Resin Cements, Caulking Compounds and other Mastics; Painters Fillings; Non-refractory Surfacing preparations for Facades, Indoor Walls, Floors, Ceilings or the like"
3215,"Ink; Printing, Writing or Drawing Ink and other Inks; whether or not Concentrated or Solid"
3301,"Oils; Essential (concretes, Absolutes); Concentrates thereof in Fats, Fixed Oils, Waxes Etc. (obtained by Enfleurage, Maceration); Aqueous Distillates, Solutions and Terpenic By-products thereof; Resinoids"
3302,"Odoriferous Substances and Mixtures (including Alcoholic Solutions) with a basis of one or more of these Substances, of a kind used as Raw Materials in Industry"
3303,Perfumes and Toilet Waters
3304,"Cosmetic and Toilet preparations; Beauty, Make-up and Skin Care preparations (excluding Medicaments, including Sunscreen or Sun Tan Preparations), Manicure or Pedicure preparations"
3305,Hair preparations; for use on the Hair
3306,"Oral or Dental Hygiene preparations, including Fixative Pastes and Powders"
3307,"Perfumery, Cosmetic or Toilet preparations; Pre-shave, Shaving, After-shave, Bath preparations; Personal Deodorants and Depilatories; Room Deodorisers, Perfumed or not with Disinfectant Properties or not"
3401,"Soap; Organic Surface-active Products, preparations for use as Soap; Bars, Cakes, Moulded Pieces Etc., not containing Soap; Paper, Wadding Felt, Non-wovens, Impregnat- Ed, Coated, Covered with Soap or Detergent"
3402,"Organic Surface-active Agents (not Soap); Surface-active, Washing (including Auxiliary Washing) and Cleaning preparations, containing Soap or not, excluding those of Heading No. 3401"
3403,Lubricating preparations and those used in Oil or Grease Treatment of Textile and similar Materials; excluding preparations containing 70% or more (by Weight) of Petroleum or Bituminous Mineral Oils
3404,"Waxes; Artificial, prepared"
3405,"Polishes, Creams, Scouring Pastes, Powders and similar; in any form, (including articles Impregnated, Coated or Covered with Such), for Furniture, Footwear, Floors, Coachwork, Glass or Metal"
3406,"Candles, Tapers and the like"
3407,"Modelling Pastes, including those for Children; Dental Wax, Impression Compounds, in Sets or Packings for Retail Sale or in Plates and similar forms; Dentistry preparations with Plaster Base"
3501,"Casein, Caseinates and other Casein Derivatives; Casein Glues"
3502,Albumins; Albuminates and other Albumin Derivatives
3503,"Gelatin (including Gelatin in Rectangular Sheets, whether or not Surface-worked or Coloured) and Gelatin Derivatives; Isinglass; other Glues of Animal Origin, excluding Casein Glues of Heading No. 3501"
3504,"Peptones and their Derivatives; other Protein Substances and their Derivatives n.e.s. or included; Hide powder, whether or not Chromed"
3505,Dextrins and other Modified Starches (e.g. Pregelatinised or Esterified Starches); Glues Based on Starches or on Dextrins or other Modified Starches
3506,"Prepared Glues and other prepared Adhesives, n.e.s. or included; Products Suitable for use as Glues or Adhesives, put up for Retail Sale as Glues or Adhesives, not exceeding 1kg Net Weight"
3507,Enzymes; prepared Enzymes not elsewhere specified or included
3601,Explosives; Propellent Powders
3602,"Prepared Explosives, other than Propellent Powders"
3603,Safety Fuses; Detonating Fuses; Percussion or Detonating Caps; Igniters; Electric Detonators
3604,"Fireworks, Signalling Flares, Rain Rockets, Fog Signals and other Pyrotechnic articles"
3605,Matches; other than Pyrotechnic articles of Heading No. 3604
3606,Ferro-cerium and other Pyrophoric Alloys in All forms; articles of Combustible Materials n.e.s. in Chapter 36
3701,"Photographic Plates and Film in the Flat, Sensitised, Unexposed, of any Material other than Paper, Paperboard or Textiles; Instant Print Film in the Flat, Sensitised, Unexposed, whether or not in Packs"
3702,"Photographic Film in Rolls, Sensitised, Unexposed, of any Material other than Paper, Paperboard or Textiles; Instant Print Film in Rolls, Sensitised, Unexposed"
3703,"Photographic Paper, Paperboard and Textiles; Sensitised, Unexposed"
3704,"Photographic Plates, Film, Paper, Paperboard and Textiles, Exposed but not Developed"
3705,"Photographic Plates and Film; Exposed and Developed, other than Cinematographic Film"
3706,"Cinematographic Film; Exposed and Developed, whether or not incorporating Sound Track or Consisting only of Sound Track"
3707,"Chemical preparations for Photographic uses (other than Varnishes, Glues, Adhesives and similar Preparations); Unmixed Products for Photographic uses, put up in Measured Portions or for Retail Sale"
3801,"Artificial Graphite; Colloidal or Semi- Colloidal Graphite; preparations Based on Graphite or other Carbon in the form of Pastes, Blocks, Plates or other Semi- Manufactures"
3802,"Activated Carbon; Activated Natural Mineral Products; Animal Black, including Spent Animal Black"
3803,"Tall Oil, whether or not Refined"
3804,"Residual Lyes from the Manufacture of Wood Pulp, whether or not Concentrated, Desugared or Chemically Treated, including Lignin Sulphonates, but excluding Tall Oil of Heading No. 3803"
3805,"Gum, Wood or Sulphate Turpentine, other Turpenic Oils; Crude Dipentene; Sulphite Turpentine, other Crude Para-cymene; Pine Oil containing Alpha-terpineol as the Main Constituent"
3806,Rosin and Resin Acids and Derivatives thereof; Rosin Spirit and Rosin Oils; Run Gums
3807,"Wood Tar; Wood Tar Oils; Wood Creosote; Wood Naphtha; Vegetable Pitch; Brewers' Pitch and similar preparations Based on Rosin, Resin Acids or on Vegetable Pitch"
3808,"Insecticides, Rodenticides, Fungicides, Herbicides, Anti-sprouting Products, Plant Growth Regulators, Disinfectants and the like, in forms or Packings for Retail Sale or as preparations or articles"
3809,"Finishing Agents, Dye Carriers to Accelerate the Dyeing, Fixing of Dyestuffs, other Products and preparations, of a kind used in the Textile, Paper, Leather or like Industries, n.e.s. or included"
3810,"Metal-pickling preparations; Fluxes Etc. for Soldering, Brazing; Welding Powders, Pastes of Metal and other Materials; preparations used as Cores or Coatings for Welding Electrodes or Rods"
3811,"Anti-knock preparations, Oxidation and Gum Inhibitors, Viscosity Improvers, Anti- Corrosive preparations and the like, for Mineral Oils (including Gasoline) or other Liquids used for the Same purposes"
3812,"Prepared Rubber Accelerators; Compound Plasticisers for Rubber or Plastics, n.e.s. or included; Anti-oxidising preparations and other Compound Stabilisers for Rubber or Plastics"
3813,Preparations and Charges for Fire Extinguishers; Charged Fire Extinguishing Grenades
3814,"Organic Composite Solvents and Thinners, not elsewhere specified or included; prepared Paint or Varnish Removers"
3815,"Reaction Initiators, Reaction Accelerators and Catalytic preparations n.e.s. or included"
3816,"Refractory Cements, Mortars, Concretes and similar Compositions; other than Products of Heading No. 3801"
3817,"Mixed Alkylbenzenes and Mixed Alkylnaphthalenes, other than those of Heading No. 2707 or 2902"
3818,"Chemical Elements Doped for use in Electronics, in the form of Discs, Wafers or similar forms; Chemical Compounds Doped for use in Electronics"
3819,"Hydraulic Brake Fluids and other prepared Liquids for Hydraulic Transmission, not containing or containing Less than 70% by Weight of Petroleum Oils or Oils Obtained from Bituminous Minerals"
3820,Anti-freezing preparations and prepared De- Icing Fluids
3821,Prepared Culture Media for Development of Micro-organisms
3822,"Composite Diagnostic or Laboratory Reagents, other than those of Heading No. 3002 or 3006"
3823,"Prepared Binders for Foundry Moulds or Cores; Chemical Products and preparations and Residual Products of the Chemical or Allied Industries, n.e.s. or included"
3824,"Prepared binders for foundry moulds or cores; chemical products and preparations of the chemical or allied industries (including those consisting of mixtures of natural products), not elsewhere specified or included"
3825,"Gum, wood or sulphate turpentine and other terpenic oil produced by the distillation or other treatment of coniferous woods; crude dipentene; sulphite turpentine and other crude para-cymene; pine oil containg alpha"
3901,"Polymers of Ethylene, in primary forms"
3902,"Polymers of Propylene or of other Olefins, in primary forms"
3903,"Polymers of Styrene, in primary forms"
3904,"Polymers of Vinyl Chloride or of other Halogenated Olefins, in primary forms"
3905,"Polymers of Vinyl Acetate or of other Vinyl Esters, in primary forms; other Vinyl Polymers in primary forms"
3906,Acrylic Polymers in primary forms
3907,"Polyacetals, other Polyethers and Epoxide Resins, in primary forms; Polycarbonates, Alkyd Resins, Polyallyl Esters and other Polyesters, in primary forms"
3908,Polyamides in primary forms
3909,"Amino-resins, Phenolic Resins and Polyurethanes, in primary forms"
3910,Silicones in primary forms
3911,"Petroleum Resins, Coumarone-indene Resins, Polyterpenes, Polysulphides, Polysulphones and similar Products of Chemical Synthesis n.e.s. in Chapter 39, in primary forms"
3912,"Cellulose and Its Chemical Derivatives, n.e.s. or included, in primary forms"
